essay_id,essay_set,essay,rater1_domain1,rater2_domain1,domain1_score
40,5,"अपने संस्मरण में, ""@व्यक्ति1 एक खुश और प्यार भरा मूड बनाता है। ऐसे समय में जब @स्थान2, @व्यक्ति2 और उनके परिवार में नस्लवाद और अलगाव सामान्य था। न्यू जर्सी के न्यूार्क में उनके घर में कई खुशहाल समय था। उनका शहर उनके शहर से भर गया था। क्यूबा, ​​स्पैनिश और इतालवी आप्रवासी। उनका पड़ोस एकजुट और मेहनती था। अपने संस्मरण में, रोड्रिगेज अपने दयालु माता-पिता के बारे में लिखते हैं। संस्मरण में कहा गया है, ""मेरे माता-पिता ने हमेशा अपने हथियार और अपने दरवाजे कई लोगों के लिए खुले रखे हैं, जिन्हें हमने माना है। परिवार, यह जानते हुए कि वे हमारे लिए भी ऐसा ही करेंगे, ""(पैराग्राफ @संख्या1)। रोड्रिगेज का परिवार हमेशा दूसरों की मदद करने के लिए तैयार था क्योंकि उन्हें पता था कि एहसान वापस मिल जाएगा। रोड्रिगेज परिवार ने पड़ोस में सभी की मदद करने के लिए अपनी मजबूत दया का इस्तेमाल किया। वापसी, उनका सम्मान किया गया। इसके अलावा, नार्सिसो रोड्रिग्ज अपने माता-पिता की बहादुरी के बारे में लिखते हैं। वह लिखते हैं, ""वे निस्वार्थ रूप से आए, जैसे कि आप्रवासी अपने बच्चों को बेहतर जीवन देने के लिए करते हैं ...."" (पैराग्राफ @संख्या1-13)। माता-पिता अपने बच्चों की मदद करना चाहते थे और टी देना चाहते थे हेम बेहतर जीवन। उन्होंने अपनी ज़रूरतों का त्याग किया और अपने बच्चों की कामना की। @नाम1 अपने माता-पिता को उनके त्याग और प्रेम के कारण प्यार करता है। अंतिम लेकिन कम से कम, नार्सिसो रोड्रिग्ज अपने माता-पिता के संघर्षों के बारे में नहीं लिखता है। वह लिखते हैं ""उन्होंने व्यक्तिगत और आर्थिक रूप से संघर्ष किया ..."" (@संख्या3)। रोड्रिगेज परिवार ने नस्लवादी कृत्यों और अपने बच्चों के लिए अलग-अलग जलवायु के माध्यम से संघर्ष किया। वे अपने बच्चों को @स्थान2 में एक बेहतर जीवन देना चाहते थे जो क्यूबा में दिया गया था। कुल मिलाकर, नार्सिसो रोड्रिग्ज अपने माता-पिता के संघर्षों के बारे में लिखते हैं जो सुखद क्षणों का नेतृत्व करते हैं।",4,3,7
41,5,"इस लेख में जो मनोदशा है, वह दुःख, उत्तेजना और माता-पिता के प्रति आभारी होगी। नार्सिसो पाक कौशल और परंपराओं के लिए आभारी है जो उसके माता-पिता ने उस पर पारित किया। मेरे जीवन की तरह ही, मैं एक अपार्टमेंट में रहता था और अपने माता-पिता की वजह से आपके लिए देखभाल करने वाले किसी अन्य घर के रूप में इसे देखता था। इसके अलावा उस वातावरण में बढ़ते हुए उसे सिखाया गया कि परिवार को रक्त से संबंधित नहीं होना है, यह पड़ोसियों या दोस्तों को हो सकता है जो भाई, बहन, चाची, चाचा की तरह हो सकते हैं।",2,1,3
42,5,"इस कहानी में मनोदशा सुरक्षा और खुशी थी। जब सभी अलग-अलग संस्कृति और विरासत वाले सभी लोग बिना किसी झगड़े या तर्क के एक साथ रह सकते थे, जब @स्थान1 में नस्लीय तनाव बहुत ज्यादा था। खुशी को कई अलग-अलग तरीकों से दिखाया गया था। एक तरीका था जब वह अपने घर में गर्मी, संगीत और खाना पकाने का वर्णन कर रहा था। इसके अलावा, जब वह इस बारे में बात कर रहा था कि उसके माता-पिता ने उसके लिए कितना बलिदान दिया, उसके लिए वह कितना शुक्रगुज़ार था। कुल मिलाकर, @व्यक्ति1 इस बात से खुश था कि उसका पूरा बचपन कैसा था और ऐसा लग रहा था कि वह इसके हर आखिरी मिनट को प्यार करता था।",2,3,5
43,5,"संस्मरण में लेखक द्वारा बनाया गया मूड खुश है। वह खुश लगता है क्योंकि, वह अपने माता-पिता, अपने परिवार और अपने घर के बारे में बात करता है जो उसे खुश करते हैं। अनुच्छेद @संख्या1 में, लेखक इस बारे में बात करता है कि रक्त-संबंधी होने का परिवार के साथ क्या संबंध नहीं है। अनुच्छेद दो में, लेखक उस सरल घर के बारे में बात करता है जिसे उसके माता-पिता ने घर बनाया था। जब आप पैराग्राफ दो पढ़ते हैं, और वह घर का वर्णन कैसे करता है, तो लेखक आपको खुश महसूस करता है। अनुच्छेद @संख्या2 में, लेखक कहता है कि वह अपने माता-पिता और उनके द्वारा दिए गए जीवन के लिए हमेशा आभारी रहेगा। यह संस्मरण और लेखक द्वारा संस्मरण में बनाए गए कुछ उदाहरण हैं।",3,3,6
44,5,"@नाम2 के संस्मरण में कई मूड थे। @नाम1 की मनोदशा ज्यादातर अपने परिवार और दोस्तों के पास होने के लिए खुश और महान थी। @नाम1 दुःखी था क्योंकि @नाम1 ने उसके साथ अपने दादा-दादी नहीं थे @नाम1 ने कहा ""मुझे अपने असली माता-पिता नार्सिसो द एल्डर और कॉन्सुएलो को नहीं पता होगा, 1970 तक जब तक उन्हें क्यूबा छोड़ने की अनुमति नहीं थी।"" @नाम1 खुश था कि उसके माता-पिता कि उसके माता-पिता उसके लिए बेहतर जीवन जीने के लिए सब कुछ छोड़ गए। @नाम2 एक मजबूत व्यक्ति है और संस्मरण में बहुत अच्छे और बुरे मूड थे।",2,2,4
45,5,लेखक द्वारा बनाई गई मनोदशा ने मुझे खुश कर दिया कि मेरे पास क्या है और जो मैं गिविन हूं उसके लिए आभारी हूं। मैंने अपने जीवन के संस्मरण में व्यक्त लेखक के सभी मूड से यह सीखा। जैसा कि मैंने कहा कि यह लेखक द्वारा व्यक्त की गई मनोदशा है।,0,1,1
46,5,"संस्मरण ""नार्सिसो @नाम1"" में मनोदशा एक खुला खुशहाल परिवार है क्योंकि उसके माता-पिता ने काम किया और उसके लिए एक शानदार घर बनाया। मुझे लगता है कि कहानी में मनोदशा एक खुला खुशहाल परिवार है क्योंकि यह कहता है कि ""इस माहौल में आगे बढ़ने से मेरे अंदर एक बड़ी भावना पैदा हुई कि"" परिवार ""को रक्त संबंधी होने से कोई लेना-देना नहीं था और वह @नाम3 है कि @नाम2 बड़ा हो रहा था उसके परिवार में ऐसे लोगों का एक समूह था जिन्हें परिवार माना जाता था लेकिन रक्त संबंधी नहीं। साथ ही पाठ में कहा गया है कि ""यह ईमानदार, मेहनती नक़ल करने वालों का एक घनिष्ठ समुदाय था, जो ऐसे लोगों का हाथ बढ़ाते थे, जो अपनी ही तरह के नहीं, स्पष्ट रूप से ज़रूरतमंद थे।"" यह सिर्फ @नाम3 है कि उसके माता-पिता अपने समुदाय के किसी ऐसे व्यक्ति को जाने देते हैं, जिसे परिवार की जरूरत हो, वह उनके परिवार का हिस्सा बन जाए, या जो कोई अकेला था, उनकी कोई कंपनी हो।",2,3,5
47,5,"इस संस्मरण में लेखक जिस मनोदशा का निर्माण करता है वह तथाकथित 'विस्तारित परिवार' के बीच रिश्तों और प्रेम की भावना है। लेखक नार्सिसो रोड्रिग्ज के परिवार और आसपास के नेहबोरों के बीच संबंधों पर जोर देता है ताकि वे परिवार हो सकें। लेखक इस लड़के के पास समग्र आनंद और खुशी की भावना को शामिल करता है, भले ही उनके पास एक छोटा सा घर हो, फिर भी वे इसे एक प्यार भरे घर में बदल सकते हैं। लेखक दिखाता है कि इस लड़के को विरासत में कितनी पसंद है और उसके मजेदार माता-पिता हैं जिन्होंने उसे खाना पकाने और क्यूबाई संगीत से प्यार करना सिखाया। इस संस्मरण से पता चलता है कि वह कैसे गरीब है, लेकिन फिर भी बहुत सारे दोस्तों और शौकीन यादों के साथ एक मजेदार और दिलचस्प जीवन हो सकता है। नार्सिसो अपने माता-पिता के लिए बहुत आभारी है और इससे पता चलता है कि वह घर की सादगीपूर्ण चीजों के लिए कितना प्रशंसनीय है। इस संस्मरण में समग्र मनोदशा का आभार व्यक्त करना होगा। उनके पास जो कुछ भी है उसके लिए किरदार इतने धन्यवाद के हैं।",2,3,5
48,5,"नार्सिसो रोड्रिगेज द्वारा ""होम: द ब्लूप्रिंट्स ऑफ़ अवर लाइव्स"" के इस अंश में, लेखक ने संस्मरण में एक बहुत ही स्पष्ट मनोदशा निर्धारित की है। नार्सिसो रोड्रिगेज का ""उनके परिवार के लिए और उनके लिए जो कुछ भी उन्होंने किया है, उसके लिए सदा आभारी हैं। उदाहरण के लिए,"" [नार्सिसो रोड्रिगेज] हमेशा अपने माता-पिता के प्रति उनके प्यार और बलिदान के लिए आभारी रहेंगे। मैंने अक्सर उन्हें बताया है कि उन्होंने जो किया वह बहुत अधिक साहसी काम था तब मैं कभी भी कर सकता था। ""@नाम1 ने"" उनकी ताकत और दृढ़ता की प्रशंसा की, और मैंने उन्हें बार-बार धन्यवाद दिया है। ""@व्यक्ति1 को लगता है कि"" कुछ भी नहीं है। इतनी कम उम्र में मुझ पर हुई उदारता की भावना के लिए आभार व्यक्त करने का तरीका और परिवार और दोस्त कितने महत्वपूर्ण हैं, इसका प्रदर्शन। ""@व्यक्ति1"" ने 'परिवार की वास्तविक परिभाषा' सीखी। """" @व्यक्ति1 कभी नहीं भूलेगा कैसे। मेरे माता-पिता ने इस साधारण घर को घर में बदल दिया। ”",3,3,6
49,5,"संस्मरण में निर्मित मनोदशा कृतज्ञ है। ""मेरे माता-पिता दोनों ने खाना पकाने के कर्तव्यों को साझा किया और अनजाने में मुझे अपने समृद्ध पाक कौशल और खाना पकाने का प्यार मिला जो आज भी मेरे साथ है।"" इससे मेरा तात्पर्य यह है कि उसने जो कुछ सीखा है, उसके लिए वह माता-पिता का आभारी है। ""मैं हमेशा अपने माता-पिता के प्रति उनके प्यार और बलिदान के लिए आभारी रहूंगा। मैंने अक्सर उन्हें बताया है कि उन्होंने जो किया उससे कहीं ज्यादा साहसी बात यह थी कि वे मुझे कभी भी कर सकते थे। उन्होंने मुझे अपने जीवन के साथ दिखाया, और ये शिक्षाएं हैं। मेरे जीवन का बिसनेस। मेरे कहने का मतलब यह है कि वह अपनी माँ और पिताजी के लिए प्यार करता है और उनके लिए क्या करता है।",3,3,6
50,5,"संस्मरण में, नार्सिसो रोड्रिग्ज, लेखक की मनोदशा खुशी थी। वह समझाता है कि वह अपने घर के लिए अपने माता-पिता के लिए महान है, ""मैं अपने माता-पिता के लिए उनके कृतज्ञता और बलिदान के लिए हमेशा आभारी रहूंगा। लेखक यह भी दिखाता है कि उसे सिखाया गया था कि उसके माता-पिता द्वारा किस तरह से काम किया जाए, और वह खुश थी। उन्होंने ऐसा किया। उन्हें लगता है कि परिवार और दोस्त भी महत्वपूर्ण हैं। इन कारणों से, लेखक ने अपने संस्मरण में खुशी का मूड बनाया।",2,1,3
51,5,संस्मरण में लेखक द्वारा बनाई गई मनोदशा खुशी है क्योंकि नार्सिसो ने जो कुछ भी किया है उसके लिए खुश है नार्सिसो अपने परिवार और अपने मूल हेटिज के लिए खुश है। उदाहरण के लिए कहानी की शुरुआत में कहते हैं कि नार्सिसो को वह हेटिज और उसका परिवार पसंद है। इसका मतलब है कि वह खुश है।,2,2,4
52,5,"लेखक द्वारा बनाया गया मिजाज खुश मिजाज है। मुझे लगता है कि यह एक खुश मिजाज है क्योंकि नार्सिसो अपने जीवन का वर्णन कर रहा है, और अंत में वह कहता है कि उसके पास एक खुशहाल जीवन है। ""मैं यह कभी नहीं भूलूंगा कि मेरे माता-पिता ने इस साधारण घर को घर में कैसे बदल दिया"" (@नाम1 @संख्या1)। मुझे लगता है कि यह एक खुशहाल बयान है क्योंकि वह कह रहा है कि उसके माता-पिता ने उसकी बहुत देखभाल की, और उन्होंने कहा कि जो एक बुरा घर हो सकता था, वह घर में बदल गया। मुझे लगता है कि जिस तरह से वह अपने पड़ोसियों के बारे में बात करता है, यह एक खुश मिजाज है। ""यह ईमानदार, परिश्रमी आप्रवासियों का एक घनिष्ठ समुदाय था, जिन्होंने ऐसे लोगों का हाथ बढ़ाया, जो अपनी ही तरह के नहीं, स्पष्ट रूप से जरूरतमंद थे"" (@नाम1 @संख्या2)। मुझे लगता है कि चूंकि वह अपने दोस्तों और पड़ोसियों के बारे में इतनी अच्छी तरह से बात करता है कि यह एक खुशहाल पड़ोस है। एक @संख्या3 और अंतिम कारण मुझे लगता है कि यह एक खुश मिजाज है क्योंकि वह अपने परिवार की बात करता है। ""वे निस्वार्थ रूप से आए ... अपने बच्चों को बेहतर जीवन देने के लिए ... मैं अपने माता-पिता के प्रति उनके प्यार और बलिदान के लिए हमेशा आभारी रहूंगा"" (@नाम3 @संख्या4 और @संख्या5)। मुझे लगता है कि वह अपने परिवार से प्यार करता है, और प्यार निश्चित रूप से एक खुश शब्द है।",3,3,6
53,5,लेखक द्वारा प्रदर्शित मनोदशा एक गर्म आरामदायक एहसास था जो घर की तरह महसूस होता था। इसने उनके छोटे से घर और परिवार और उनकी रुचियों को दिखाया और कैसे उन्होंने सभी के साथ मिलकर काम किया। यह वास्तव में दिखाती है कि उसने घर पर क्या कहा और उसने एक परिवार को क्या कहा। संस्मरण ने उनके द्वारा खाया गया भोजन और उनके द्वारा सुने गए संगीत के बारे में बताया कि वह बचपन में कैसे बड़े हुए।,2,2,4
54,5,"लेखक द्वारा बनाई गई मनोदशा खुशी थी। क्योंकि हर एक एक परिवार के रूप में एक साथ आया था और वे एक-दूसरे की तलाश में थे, जब वे जरूरत में थे। उन्होंने एक दूसरे की मदद भी की और दयालु और मिलनसार थे।",1,1,2
