essay_id,essay_set,essay,rater1_domain1,rater2_domain1,domain1_score
55,5,"इस संस्मरण में मन हर्षित है। यह संस्मरण हृदयविदारक है क्योंकि यह उसके माता-पिता के बारे में क्यूबा से @नाम1 में आया है। एस। यह अच्छा है कि कैसे गोरा-ईंट का घर बेहतर था लेकिन फिर भी वही घर जैसा उनके माता-पिता रहते थे। क्यूबा के संगीत ने घर की हवा को ऐसे भर दिया जैसे क्यूबा में एक घर था। एक घर एक घर नहीं है जब तक आप इसे घर नहीं कहते। उस परिवार ने हमेशा के लिए अपना घर बना लिया। हालांकि उनका परिवार 1970 तक नीचे नहीं आ सकता है, फिर भी उनके पास घर पर कॉल करने की जगह होगी जैसे कि नार्सिसो रोड्रिगेज ने किया था। जैसे उन्होंने संस्मरण में कहा ""मैं कभी नहीं भूलूंगा कि कैसे मेरे माता-पिता इस साधारण घर को घर में बदल देते हैं""।",2,3,5
56,5,"लेखक की मनोदशा है, और खुश है। मुझे यह पता है क्योंकि @नाम1 उनके परिवार और दोस्तों और उनके @नाम3 के बारे में बात करता है। @नाम1 ने हमें अपने पहले दोस्त @व्यक्ति1 के बारे में बताना शुरू किया और वे उनके ऊपर कैसे रहते थे। ""@व्यक्ति1 मेरी दाई और मेरा पहला दोस्त हमारे ऊपर रहता था और @व्यक्ति1 भोजन से अधिक बार हमारी मेज पर कब्जा कर लेता था।"" @नाम1 @नाम2 अपने पहले दोस्त को कैसे बनाना था। @नाम1 ने यह भी पता लगाया कि उसके माता-पिता ने घर कैसे बनाया और कैसे @नाम3 हमेशा के लिए वहां रहेगा। ""मैं कभी नहीं भूलूंगा कि मेरे माता-पिता ने इस साधारण घर को घर में कैसे बदल दिया।"" @नाम1 वास्तव में शानदार है और उसका मूड खुश और शांत है। क्योंकि उनके परिवार की शुरुआत कैसे हुई और कैसे @नाम1 अपने दोस्तों से मिले, इस बारे में बात करने में संकोच करते हैं।",2,3,5
57,5,"संस्मरण में लेखक ने सेटिंग और चेटर्स के बारे में विवरण का उपयोग करके एक मूड बनाया, कहानी में जो मूड था, वह दोस्ती है। पैराग्राफ @संख्या1 में, यह ""@नाम1 भोजन के लिए हमारी रसोई की मेज पर अधिक बार नहीं की तुलना में ग्रेड किया है।"" लेखक समझा रहा है कि लगभग हर रात खाने के लिए उसके घर पर उसके पारिवारिक मित्र थे। एक और मूड जो संस्मरण में है, वह है ध्यान रखना। पैराग्राफ @संख्या1 में, यह कहता है ""अक्सर कोई हमारे साथ अस्थायी रूप से रहता था जब तक कि वे अपने पैरों पर वापस आने में सक्षम नहीं थे।"" इससे पता चलता है कि भले ही लेखक परिवार के पास एक छोटा सा घर था लेकिन वे लोगों को उनके साथ रहने के लिए छोड़ देते थे। संस्मरण में आखिरी मूड खुशी का है। पैराग्राफ @संख्या3 में, यह कहता है कि ""मैंने अपना पहला जन्मदिन मनाया। मनोदशा इस विनम्र घर में रसोई घर की गर्मी में थी, जहां एक क्यूबा के दावत में हवा भर जाती थी।"" लेखक बताते हैं कि कैसे उनका जन्मदिन उनके दोस्तों और परिवार के साथ था। ये कहानी में मुख्य मूड के केवल तीन हैं।",2,4,6
58,5,"दिल को छूने। यही वह मनोदशा है जिसे नार्सिसो रोड्रिग्ज अपने यादगार घर: द ब्लूप्रिंट्स ऑफ आवर लाइफ में बनाता है। नरसीसो भावुक क्यूबा की संस्कृति, उनके स्वागत वाले घर और उनके देखभाल करने वाले और निस्वार्थ माता-पिता की बात करते हैं। नारसीसो ने अपने घर का वर्णन करते हुए कहानी शुरू की। वह बताते हैं कि यह क्यूबा की संस्कृति से भरा हुआ था। खाद्य संगीत और सभी। नार्सिसो पैराग्राफ @संख्या1 में कहा गया है ""मेरे माता-पिता दोनों ने खाना पकाने के कर्तव्यों के प्यार को साझा किया और अनजाने में अपने समृद्ध पाक कौशल और मेरे लिए खाना पकाने का एक प्यार है जो आज भी मेरे साथ है (और जिसके लिए मैं बाहरी रूप से आभारी हूं)। पैशनेट क्यूबा का संगीत। (जिसे मैं आज तक मानता हूं) रसोई की सुगंध के साथ मिलाकर हवा को भर दिया। "" यह वर्णन पाठक को अपने बचपन के घर की गर्म संस्कृति को चित्रित करने की अनुमति देता है। तब, नारसीसो बताते हैं कि उनका घर हमेशा दोस्तों के परिवार और पड़ोसियों के लिए खुला था। वह बताते हैं कि वे सभी एकजुट थे क्योंकि देश नस्लवाद से भरा था। जिसे दूर करने के लिए उन्हें एक साथ रहने की जरूरत थी। नार्सिसो के पैराग्राफ @संख्या2 में कहा गया है ""मेरे माता-पिता ने हमेशा अपने हथियार और अपना पैसा उन लोगों के लिए खुला रखा जिन्हें हम परिवार मानते थे, यह जानते हुए कि वे हमारे लिए भी ऐसा ही करेंगे।"" यह सिर्फ पाठक को आमंत्रित करता है। लास्ट में, नारसिसो ने अपने माता-पिता के प्रति अपनी कृतज्ञता के बारे में बताया। वह पैराग्राफ @संख्या3 में कहता है ""मैं अपने माता-पिता के प्रति उनके प्यार और बलिदान के लिए हमेशा आभारी रहूंगा। मैंने अक्सर उन्हें बताया है कि उन्होंने जो कुछ किया वह बहुत अधिक समृद्ध चीज थी जो मैं कभी भी कर सकता था।"" अपने माता-पिता के प्रति उनकी कृतज्ञता और प्यार सिर्फ पाठकों के दिल को गर्म करता है ... नार्सिसो रोड्रिगेज ने ईमानदारी और ईमानदारी से अपने संस्मरण होम: द ब्लूप्रिंट्स ऑफ आवर लाइफ में एक दिल को छू लेने वाले मूड का निर्माण किया। @महीना1 उनका संदेश सदियों तक चलाया जाता है।",4,4,8
59,5,"इस @नाम2 में @नाम1 @नाम3 बहुत खुश है और हमेशा की तरह वे एक परिवार के रूप में कुछ कर रहे हैं। यह पूरे मामले में @नाम4 @संख्या1 में यह दिखाता है। यह दर्शाता है कि @नाम5 यह दिखाता है कि वह @नाम6 अपने परिवार के जितना करीब है, जितना वह अपने आसपास के अन्य लोगों के साथ है। और इसका मतलब है कि बहुत सारी चीजों का मतलब है @नाम5 वह वास्तव में बहुत अंग्रेजी नहीं जानता है और उन सभी लोगों को उसके जीवन पर एक महत्वपूर्ण प्रभाव होने के लिए एक @नाम8 और गैर-क्यूबा के रूप में है, यह है कि कैसे और जहां यह @नाम1 में दिखाता है @नाम2।",2,1,3
60,5,"जब कोई लेखक लिख रहा होता है, तो मूड सेट करना वास्तव में महत्वपूर्ण होता है। संस्मरण में बनाया गया मिजाज दिल दहला देने वाला है और यह दर्शाता है कि यह व्यक्ति अपने घर के लिए कितना महान है, हालांकि यह बहुत छोटा था। नारसीसो रॉड्रिग्ज एक छोटे से भीड़ भरे घर में रहता था, हालांकि यह तथ्य था कि उसके माता-पिता ने यह सुनिश्चित करने के लिए कड़ी मेहनत की कि नार्सिसो एक अच्छा जीवन था, जिसने उनके घर को महान बना दिया। उनके माता-पिता ने उनके पास जो कुछ भी था उसे सबसे अच्छा बनाया और उसे जुनून, प्यार और हँसी से भर दिया। लेखक ने संस्मरण के मूड को स्थापित करते हुए बहुत अच्छा काम किया। जब वह अपने घर के पाठकों के बारे में बात कर रहा था, तो वह भोजन, @नाम1 भोजन को लगभग महसूस कर सकता था, और संगीत सुन सकता था। मनोदशा उत्थानशील है और लेखक बहुत आभार दिखाता है। जब आप सभी सुखद यादों और देखभाल करने और देने की वजह से संस्मरण पढ़ते हैं तो यह आपको मुस्कुराता है। नार्सिसिस रोड्रिग्ज के पास अद्भुत माता-पिता थे जिन्होंने उसके लिए बहुत कुछ किया। अपने संस्मरण में, वह एक उत्कृष्ट कार्य करता है जो मूड को सेट करता है और पाठक बता सकते हैं कि वह कितना महान है।",3,2,5
61,5,"लेखक ने संस्मरण में जो मूड बनाया है वह एक रोलर कोस्टर है। यह ऊपर-नीचे होता है। इस कहानी की शुरुआत में, इसे छोड़ दिया गया था। यह मूल रूप से सिर्फ रॉड्रिग्ज है जिसमें वह रहने वाले क्रमी क्वार्टर का वर्णन करता है। लेकिन, जैसे-जैसे कहानी आगे बढ़ती है, यह खुशी से भर जाता है और भले ही जीवित रहने की स्थिति में यह सब महान था, फिर भी वह मज़ेदार था। अंत में, घर भौतिक स्थान के बजाय रिश्तों के बारे में है।",2,1,3
62,5,संस्मरण में लेखक द्वारा बनाई गई मनोदशा का ध्यान रखा जा रहा है क्योंकि उनकी मां ने लोगों को अपने पैरों पर वापस आने में मदद करने के लिए एक घर दिया और अपनी बाहों को खुला रखा। साथ ही लेखक द्वारा संस्मरण में बनाया गया मूड आभारी है क्योंकि लेखक अपने जीवन के लिए हर समय अपने माता-पिता का धन्यवाद करता है।,1,1,2
63,5,"@नाम1, नार्सिसो रोड्रिगेज में, लेखक परिवार, घर और संस्कृति की रूपरेखा बनाता है। ""हमारे पारंपरिक क्यूबा घर का निर्माण किया, जिसमें से बहुत दिल रसोई था।"" इस उद्धरण से पता चलता है कि नार्सिसो और उनके परिवार की अपनी संस्कृति के लिए बहुत समझ और कृतज्ञता थी। @नाम1 का कहना है कि उन्होंने आने वाले किसी भी व्यक्ति के लिए दरवाजा खोल दिया और उन्होंने हमेशा परिवार के साथ रात का भोजन किया। यह दर्शाता है कि करीबी परिवार @नाम2 में पले-बढ़े। नार्सिसो बताता है कि कैसे उसके माता-पिता ने एक घर को एक घर में बदल दिया।",2,2,4
64,5,"नार्सिसो रोड्रिगेज द्वारा ""नार्सिसो रोड्रिगेज"" संस्मरण में, @नाम1 इस बारे में बात करता है कि कैसे उसकी क्यूबा की जड़ों और माता-पिता के प्यार ने घर बनाने में मदद की और न सिर्फ एक साधारण घर। इस लेख में, रोड्रिगेज अपने घर के बारे में बात करके एक गर्म और शांत मनोदशा बनाता है। @नाम1 ने पता लगाया कि उनका परिवार और नीयनहुड कितना तंग-बुनयाद था क्योंकि यह उनकी संस्कृति के प्रेम और संकलन के कारण था। यह कहकर @नाम1 आपको अपने घर और बचपन में एक गर्म शांत मनोदशा (आलंकारिक रूप से) आमंत्रित करता है।",2,1,3
65,5,"इस संस्मरण में लेखक द्वारा बनाई गई मनोदशा आभार, खुशी और एकता है। यह कई अलग-अलग तरीकों से ध्यान देने योग्य है जैसे कि जब नरसीसो कहते हैं, ""मैं अपने माता-पिता के प्रति उनके प्यार और बलिदान के लिए हमेशा आभारी रहूंगा।"" यह क्यूबा में अपने जीवन को छोड़ने के लिए अपने माता-पिता के प्रति आभार नरसीसो को दर्शाता है। इस संस्मरण में मनोदशा का एक और उदाहरण है जब नार्सिसो बताता है ""यहाँ बचपन की मासूमियत में, परिवार और दोस्तों की मण्डली, और अंतहीन उत्सव ...."" यह मार्ग नारसिसो के घर में खुशी दिखाता है। लेखक द्वारा इस्तेमाल किए गए स्वर से यह स्पष्ट है कि ये खुशी के समय थे। अंत में जब नार्सिसो कहते हैं, ""हमारे पड़ोस में कहीं और रीति-रिवाजों के बावजूद, ये सभी संस्कृतियां एक साथ आईं।"" यह उन लोगों की विभिन्न जातियों के बावजूद कहानी में एकता दिखाता है जो नार्सिसो के आसपास रहते थे। इस तरह खुशी, कृतज्ञता और एकता ने इस संस्मरण में एक मूड बनाया।",3,3,6
66,5,"मेरे दृष्टिकोण से मूड एक शांत और आरामदायक भावुक भावना होगी। जब लेखक इस बारे में बात करेगा कि उसके माता-पिता ने कितनी भावनाओं और इतनी संस्कृति को पारित किया है, तो यह मुझे सोचने लगा कि मैं कौन हूं और मैं कहां से हूं। इसने मुझे खाना पकाने और संगीत और परिवार के बारे में गर्मजोशी भरा एहसास दिया और मैं इससे संबंधित हो सकता हूं। इसने मुझे दृढ़ता का एहसास दिलाया और जो आप में विश्वास करते हैं उसके लिए प्रयास करना बंद नहीं किया। इसने मुझे मजबूत महसूस कराया और मेरी माँ और परिवार के प्रति समर्पण को प्रेरित किया।",2,2,4
67,5,"@व्यक्ति1 द्वारा संस्मरण की मनोदशा अपने माता-पिता के लिए प्यार और करुणा है। वह बताता है कि कैसे वह क्यूबा के लिए गर्व के साथ बड़ा हुआ और कैसे वह अभी भी क्यूबा के संगीत से प्यार करता है। उनके माता-पिता ने उन्हें ये गुण दिए, जिन्हें वह स्वीकार करते हैं, लेकिन वे ""उनके समृद्ध पाक कौशल के लिए सदा आभारी हैं, जो उनके माता-पिता द्वारा उन पर पारित किए गए थे। @व्यक्ति1 ने उस वातावरण में"" परिवार ""की भूमिका के बारे में भी बात की, जिसमें वह ऊपर उठे थे। । उसके पड़ोस में, कई लोग नस्लवाद के शिकार थे, इसलिए वे सभी एक मजबूत बनकर आए थे। इस तरह बड़े होकर उन्होंने सीखा कि जो लोग जरूरतमंद थे, उन्हें कैसे मदद करना है। @व्यक्ति1 ने भी पाठक को बताया। उनके माता-पिता ने जिस साहस के साथ उन्हें जाना और प्यार किया था, उसे छोड़कर वह कैसे चाहते थे, वही साहस था, लेकिन कम से कम उन्हें इसके बारे में पता था।",3,3,6
68,5,"से संस्मरण में: नार्सिसो रोड्रिगेज द्वारा होम द ब्लूप्रिंट्स ऑफ़ अवर लाइव्स। मनोदशा नार्सिसो बनाता है उनके संस्मरण में एक प्रकार का प्रेमपूर्ण मनोदशा है। इस मनोदशा का वर्णन द @नाम1 द्वारा किया गया है ""मैंने सीखा कि कैसे प्यार करना है। मैं कभी नहीं भूलूंगा, और माता-पिता ने इस साधारण घर को घर में बदल दिया""। इससे पता चलता है कि वह अपने घर से कैसे प्यार करता था। इसके अलावा, @नाम1 ने मुझे अपने समृद्ध पाक कौशल और खाना पकाने का एक प्यार दिया, जो आज भी मेरे साथ है और उसके लिए मैं बाहरी रूप से आभारी हूं। यह दर्शाता है कि वह प्यार करता था कि उसके माता-पिता उसे खाना पकाने और खाना पकाने के लिए प्यार करते थे।",2,2,4
